{
  "schema_version": "1.0.0",
  "orb_id": "prontopc-repair-plan",
  "orb_version": "0.1.0",
  "ability_name": "AI repair-plan author",
  "purpose": "Turn real diagnostics into a genuine model-authored repair plan (summary + actions drawn only from the repair-engine catalogue, referencing the actual diagnostics) OR an explicit unavailable status. Never a heuristic plan presented as the AI plan. Structurally kills Manifest I2 and C3.",
  "runtime": {
    "language": "csharp",
    "form": "library",
    "entrypoint": "ProntoPC.GemmaLocalPlanner"
  },
  "capabilities": [
    { "name": "author_plan", "function": "Build a prompt from diagnostics; the model selects only from the repair-engine catalogue; return summary + actions + provenance." },
    { "name": "provider_order", "function": "local-model only. Cloud LLM provider fallback and Cloud Run plan brokering are retired." },
    { "name": "honest_unavailable", "function": "If every provider fails, return status:unavailable with a reason. There is no code path that emits a heuristic plan under status:ok." },
    { "name": "catalogue_integrity", "function": "Every emitted action.id is a member of the prontopc-repair-engine catalogue, so plan and engine cannot drift." }
  ],
  "demonstration": {
    "input_fixture": "fixtures/repair-plan.input.json",
    "expected_outputs": [
      "status:ok plan that references the supplied diagnostics (disk/memory/temp/etc.)",
      "provenance.provider + provenance.model present on every ok plan",
      "with all providers forced down: status:unavailable, never a heuristic plan"
    ],
    "observable_events": [
      "plan.requested { session }",
      "plan.provider_selected { provider, model }",
      "plan.authored { action_count } | plan.unavailable { reason }"
    ]
  },
  "umbilicals": ["umbilical.json"],
  "evidence": {
    "created_utc": "2026-08-27T00:00:00Z",
    "source": "PROMOTED to provisional 2026-08-28 (TOTEM-0014). C3 is satisfied ON-DEVICE: the local-model Satellite (int4 gemma-3-1b-it) authors a genuine plan offline (provenance=local-model), proven by tests/ModelSmoke and WPF flow evidence. The old 'C3 is LIVE-only' gate no longer applies; Cloud Run plan brokering is retired. The rule-based ShowOfflinePlan was REMOVED (TOTEM-0013): the app never presents a non-AI plan under the AI claim. Under the one-time paid Store app pivot, AI-unavailable shows local support guidance rather than minting a backend coupon. Gemma license + Prohibited Use Policy bundled in-app (TOTEM-0014). Envelope enforced; WPF build and ModelSmoke verified at TOTEM-X-0117.",
    "trust_state": "provisional"
  }
}
